id,dead,type,by,time,text,parent,kids,url,score,title,descendants
26665098,,comment,bongoman37,2021-04-01 20:40:35,"IP masking was applied very early but it did cut down a large number of requests, I am not sure how many though. Next were filters that would block devices sending more than a few hundred requests a minute or so on. These would be usually bots or compromised devices. Then we would look at cuts of traffic where the characteristics were outside of acceptable parameters and block those. E.g., say a particular OS, OS version, device model, request country etc. This could be made much more granular. If you see too high a CTR or too low a conversion rate, or abnormal time between ad being displayed and being clicked on (fraud clicks had a tighter distribution between request and click as compared to genuine clicks) or any other weird stuff, you could block that cut of traffic.<p>Also, we refrained from calling it fraud, the term was invalid traffic. This also accounted for things like someone double tapping on an ad instead of once, and so on. There is a good report by Alexander Tuzhilin [1] commissioned by Google when they were sued for charging for invalid traffic that might give you some more ideas.<p>[1] <a href=""https:&#x2F;&#x2F;googleblog.blogspot.com&#x2F;pdf&#x2F;Tuzhilin_Report.pdf"" rel=""nofollow"">https:&#x2F;&#x2F;googleblog.blogspot.com&#x2F;pdf&#x2F;Tuzhilin_Report.pdf</a>",26662510,{26668324},,,,
26665099,t,story,hibahashmi,2021-04-01 20:40:44,,,,https://shumailapc.com/glary-utilities-crack/,1,Glary Utilities 5.163.0.189 Crack Plus Keygen Free Download 2021,
26665100,,comment,junon,2021-04-01 20:40:45,"Here&#x27;s the thing. People who respect science will understand its imperfections and iterative processes, how evidence really works and how &quot;truth&quot; is hard to come by.<p>The people that want these sorts of apologies are the ones that are looking for reasons to deny science. Those sorts of people simply never change, and will always look for reasons to disregard it.<p>So no. This wouldn&#x27;t solve anything. It&#x27;d just make things worse.",26663439,{26665472},,,,
26665101,,comment,kiwijamo,2021-04-01 20:40:46,Why wasn&#x27;t this done before?,26664166,,,,,
26665102,,comment,stevenhuang,2021-04-01 20:40:48,"Yeah.<p>When I gave this a shot a while back, I looked at its dependencies and it was way larger than the footprint of coc-clangd for some reason.<p>Wasn&#x27;t a good signal so decided to remove it after that.",26664629,{26665481},,,,
26665103,,comment,neallindsay,2021-04-01 20:41:09,I love a good math article where &quot;digital&quot; means &quot;base 10&quot;.,26643812,"{26665257,26668845,26665286}",,,,
26665104,,story,threedliams,2021-04-01 20:41:14,,,"{26670508,26666560}",https://www.chodejs.com/,1,Show HN: JavaScript linter for keeping files small and modular,5
26665105,,comment,obviouslynotme,2021-04-01 20:41:17,"If you are looking for a super simple CRUD site, then Ruby on Rails is best in class.<p>1. Up and running immediately.<p>2. Generate 99% of the code if you don&#x27;t care about styling.<p>3. The small portion of your site where you need something more complex is simple Ruby code instead of spending months reading No-Code documentation.",26657803,,,,,
26665106,,comment,monument_will,2021-04-01 20:41:23,"Monument | Senior Software Engineer | Based in NYC, Remote Friendly | <a href=""https:&#x2F;&#x2F;joinmonument.com"" rel=""nofollow"">https:&#x2F;&#x2F;joinmonument.com</a><p>Monument is an alcohol addiction treatment platform for those looking to change their relationship with drinking. Designed for sobriety or moderation, Monument plans are personalized to members’ goals and lifestyle, and available entirely online. Plans include access to the Monument community, video call therapy, and physician-prescribed medication. We believe treatment should be affordable, accessible, and customizable, because life shouldn’t have to stop for recovery.<p>We’re looking for a senior software engineer to join our team (based in NYC but open to applicants in all US time zones). This is a broad role that will contribute to our JavaScript-based frontend and backend as we push towards a broad public launch.<p>Tech: NodeJS, React, Typescript, PostgreSQL, Redis, AWS, Docker.<p><a href=""https:&#x2F;&#x2F;angel.co&#x2F;l&#x2F;2tX2Ec"" rel=""nofollow"">https:&#x2F;&#x2F;angel.co&#x2F;l&#x2F;2tX2Ec</a>",26661443,,,,,
