id,dead,type,by,time,text,parent,kids,url,score,title,descendants
25616094,,comment,deadw3ight,2021-01-02 20:19:27,"Go on ebay and purchase a Pebble Time. Color epaper display, fully hackable even after being discontinued thanks to the dev community who continues to update it with &quot;Rebble&quot; the open source version of the OS it ran on.",25615805,"{25620211,25616702}",,,,
25616095,,comment,jpindar,2021-01-02 20:19:30,"New York borders Rhode Island in the water.<p>Google maps shows a border.<p><a href=""https:&#x2F;&#x2F;www.google.com&#x2F;maps&#x2F;place&#x2F;Long+Island+Sound&#x2F;@41.3418146,-71.9744554,10z&#x2F;data=!4m5!3m4!1s0x89e86f39ca0d0407:0x3539de7003335332!8m2!3d41.0748454!4d-72.9460566"" rel=""nofollow"">https:&#x2F;&#x2F;www.google.com&#x2F;maps&#x2F;place&#x2F;Long+Island+Sound&#x2F;@41.3418...</a>",25615916,,,,,
25616096,,comment,0xFluegel,2021-01-02 20:19:31,"The sensor needs a lot more energy. This produces two types of IR cams: actively and passively cooled.
The passive cooling is easy to take around with you but only possible with a smaller sensor.<p>As for the price per pixel: I don&#x27;t know from memory.",25615987,,,,,
25616097,,comment,intricatedetail,2021-01-02 20:19:39,I only use Windows because of a couple of tools there is no equivalent version for Linux. Unfortunately companies think there would be not enough customers to warrant development for that OS so I am kind of stuck with maintaining dedicated Windows PC. I have mixed feelings about Microsoft appropriation of Linux. Whatever they touch turns to excrement with a few exceptions.,25612962,,,,,
25616098,,comment,mottosso,2021-01-02 20:19:43,"This topic and responses to it warms my heart. :) I&#x27;ve made it a habit for my current project to turn changelogs into blog-like material for the end-user. The kind of changelog I would like to see from other software, especially the kind I care about.<p>For example: <a href=""https:&#x2F;&#x2F;learn.ragdolldynamics.com&#x2F;releases&#x2F;2020.12.01&#x2F;"" rel=""nofollow"">https:&#x2F;&#x2F;learn.ragdolldynamics.com&#x2F;releases&#x2F;2020.12.01&#x2F;</a>",25612176,,,,,
25616099,,comment,orange_tee,2021-01-02 20:19:49,"OSM always worked better for me. I suspect this is going to be very location dependent. 
I guess in the US Google tries really hard to get good data or maybe it is easier to get good data.
I lived in various countries in Europe, always in smaller cities and rural areas. OSM data is always more reliable for whatever reason. I noticed and was rather surprised that even my small hometown of 5000 people had multiple OSM contributors.",25615394,,,,,
25616100,,comment,Retric,2021-01-02 20:19:49,"That’s very much an exaggeration.  Pixar&#x2F;Google etc can’t run on a single desktop CPU and spends a lot of money on hardware.  The best estimate I have seen is it’s scale dependent.  At small budgets your generally spending most of that on people, but as the budget increase the ratio tends to shift to ever more hardware.",25616001,"{25616183,25618455}",,,,
25616101,,comment,ttymck,2021-01-02 20:19:53,"While I appreciate the feedback, the goal of the site is to &quot;crowdsource&quot; the snippets, i.e. they are all user submitted, and then the public votes on whether it is &quot;bad&quot; or &quot;not so bad&quot;.",25606238,,,,,
25616102,,comment,gpm,2021-01-02 20:20:14,My housemate was just rolling back from python 3.8 to 3.7 yesterday due to a backwards incompatible change breaking a library... it&#x27;s not just 2 -&gt; 3 that makes python relatively unstable compared to rust.,25615890,"{25618103,25642431,25616578}",,,,
25616103,,comment,cutemonster,2021-01-02 20:20:16,"&gt; People are kept separate<p>Good point. And they &quot;self segregate&quot; themselves too? If there&#x27;re two kids, and one is a lot brighter than the other,  i think both of them will tend to get frustrated when playing together or deciding what to do -- so they&#x27;ll find others to play with.<p>Maybe this a bit applies to emotional intelligence too.<p>One&#x27;s whole life, one a bit chooses people with similar &quot;capabilities&quot;, without thinking about it?<p>And then, from time to time, one sees in the newspapers what the vastly different people do, and get surprised: can there really be such people, where are all those people",25612236,,,,,
25616104,,comment,semi-extrinsic,2021-01-02 20:20:52,"I think it&#x27;s a combination of physics (wavelength is 20x larger than visual light, making optics and sensors trickier) and export control, as you could (literally) weaponize a high-res thermal camera to make an autonomous drone&#x2F;missile targetting hot exhaust etc.",25615987,,,,,
25616105,,story,kawera,2021-01-02 20:21:01,,,"{25616414,25616409,25616429}",https://www.nytimes.com/2021/01/02/us/politics/russian-hacking-government.html,10,"As Understanding of Russian Hacking Grows, So Does Alarm",4
25616106,,comment,imtringued,2021-01-02 20:21:04,You have to consider that healthcare is a wealth transfer from older people to younger people because young workers are taking care of the old. It&#x27;s entirely possible that what you propose is a net loss economically.,25615604,,,,,
25616107,,comment,stephen_greet,2021-01-02 20:21:05,"Close Tools [1] is run by one person and they&#x27;re currently at $40k MRR.<p>[1] <a href=""https:&#x2F;&#x2F;jdnoc.com&#x2F;open&#x2F;"" rel=""nofollow"">https:&#x2F;&#x2F;jdnoc.com&#x2F;open&#x2F;</a>",25614966,"{25621849,25633136}",,,,
25616108,,comment,,2021-01-02 20:21:30,,25615940,,,,,
25616109,,comment,mynegation,2021-01-02 20:21:32,"That might be a good time to share my anecdote. Back in 2017 I was driving in Mexico using maps.me in offline mode (saving on ex-orbitant data roaming fees). At one point, the highway did a wide turn, and some village was tucked away in this turn.<p>Maps.me decided it would be a good idea to cut through the village as its main street connected two points on the bending highway like a chord. Yes, in terms of distance it was shorter, if you do not account for the allowed speed limit and conditions. I spent 10 minutes slowly crawling through the village trying not to kill any chickens. I was also low on gas and had barely enough to get to the next gas station, so I was not amused.<p>Since then I always triple-check maps.me routes, looking at the whole route and checking it against google maps if I have a chance.<p>To be fair, it has probably more to do with maps.me routing algorithm than OSM data, but it is hard to know.",25615394,{25616165},,,,
26565575,,comment,varispeed,2021-03-24 10:51:17,"At some point some companies have become too big to disrupt.  I think the best way is to partition companies that grew too big, that could be called disruption if you will. I&#x27;d like to see Alphabet holding to be dismantled and all products moved into separate independent companies.",26564931,{26565945},,,,
23819856,,comment,georgyo,2020-07-13 13:08:05,"It comes with it&#x27;s own, but it is trivial to add your own via system policies.",23819832,,,,,
28407533,,comment,mook,2021-09-03 19:20:15,"Video games are immersive experiences: you&#x27;re interacting with only the video game when you play it (or at least, that&#x27;s the design), and you don&#x27;t experience the jarring from task switching because you don&#x27;t switch.<p>For desktop applications — especially a password manager whose main use involves switching to it quickly to find something to enter into a different application — there is a lot of that resistance when you go between apps that feel totally different.<p>(I currently work on an Electron app — but that&#x27;s because it was already one when I joined the team, and it&#x27;s in a space where time to market for multiple platforms is definitely more important than a good polished experience, at least at the stage we&#x27;re at. Sad as that is.)",28404717,,,,,
28407534,,comment,rdtsc,2021-09-03 19:20:18,"Well that&#x27;s why I highlighted the odd tone in the email.<p>The other odd thing was the &quot;Make Ashley&#x27;s Life a Living Hell&quot; ticket screenshot. It looks incredibly bad, but then she replies on the ticket which can be perceived as playing along. I understand that victims sometimes cope that way, by pretending to go along, hoping the abuse would stop, but at the same time, it makes it harder to convince others later how bad things were.",28404482,,,,,
28407535,,comment,tyingq,2021-09-03 19:20:22,"Got 3 beers in Germany when I wanted 2 many, many, times before I learned.",28401356,{28407621},,,,
28407536,,comment,zepto,2021-09-03 19:20:29,"&gt; isn’t the premise that if privacy was rampant and patents didn’t exist then more people and companies would be able to innovate on the technology<p>No, because innovating on technology costs money and if you can’t get a return on that, the incentive to invest is eliminated.<p>The eInk situation is indeed dysfunctional, but the fact that one patent holder is bad at business doesn’t mean much more than that.",28406142,"{28407640,28411455}",,,,
28407537,,comment,dboreham,2021-09-03 19:20:30,"Based on my experience living in a &quot;red state&quot; in the USA, it really doesn&#x27;t take that level of sanction. People almost universally wore masks in grocery stores here when: a) it was a state mandate&#x2F;law and b) the asshole state politicians kept their mouths shut about it. Prior to the state mandate there was a patchwork of business and local health dept mandates that were far less well observed. Then subsequently (when the governor changed from Dem to GOP) the politicians realized they could score points with the &quot;not gona do it&quot; crowd by criticizing mask wearing and we went back to nobody wearing masks. And finally, delta variant seems to have scared a significant cohort into voluntary mask wearing.",28407321,,,,,
28407538,,comment,harry8,2021-09-03 19:20:33,10 or 42?,28406874,{28407568},,,,
28407539,t,story,ramaprasad,2021-09-03 19:20:36,,,,https://planetstoryline.com/open-source-software-economics-and-community-health-analytics-enter-chaoss/,1,Open-source software economics and community health analytics: Enter CHAOSS,
28407540,,comment,imwillofficial,2021-09-03 19:20:38,"Can’t tell, monasto and folks keep settling",28405565,{28456748},,,,
28407541,,comment,numbsafari,2021-09-03 19:20:40,&gt; The masked group might just take longer to get there.<p>That&#x27;s not a bad thing. Remember &quot;flatten the curve&quot;?<p>Avoiding everyone from getting it isn&#x27;t the goal. Preventing the collapse of the healthcare system is.,28407452,"{28407961,28408032}",,,,
28407542,,comment,makeitrein,2021-09-03 19:20:45,"Hey HN, I&#x27;m the front-end dev&#x2F;designer of this dApp, and I&#x27;m really proud of the way it&#x27;s turning out!<p>Been hacking on this for the past 3 months... couldn&#x27;t have gotten the Tron-like UI without the amazing arwes.dev React framework.<p>I know there&#x27;s a good deal of crypto skepticism on HN right now (rightfully so), but I&#x27;m happy to answer any questions about the design or mission to the best of my ability!",28407509,,,,,
28407543,,comment,jimbob45,2021-09-03 19:21:00,"&gt;Schedule II drugs, substances, or chemicals are defined as drugs with a high potential for abuse, with use potentially leading to severe psychological or physical dependence<p>That describes Fentanyl very well. Compare that to...<p>&gt;Schedule I drugs, substances, or chemicals are defined as drugs with no currently accepted medical use and a high potential for abuse<p>There are clear uses for Fentanyl. However, you could argue that we could phase out use of Fentanyl for any procedure in favor of other drugs and I wouldn&#x27;t be opposed (which would shift it up to Schedule 1).",28407284,{28408732},,,,
28407544,,comment,docflabby,2021-09-03 19:21:03,I&#x27;ve got one of each (wd red&#x2F;ironwolf) in my Nas at the moment both still going strong 4 years later.,28407237,{28407630},,,,
28407545,,comment,lhorie,2021-09-03 19:21:06,"Here&#x27;s a food analogy: everyone wants to buy the best looking apples, but then farmers are more incentivized to breed for looks than nutritious value, even though nutritious value is the superior metric.<p>Similarly, if everyone seeks to &quot;dumb down&quot; programming, you end up with a large pool of &quot;dumbed down&quot; programmers, which is counterproductive precisely because AI is imperfect and you need a higher level of expertise to compensate for its shortcomings. As Kernighan famously said: &quot;Debugging is twice as hard as writing the code in the first place. Therefore, if you write the code as cleverly as possible, you are, by definition, not smart enough to debug it.&quot; Similarly, if one lets the AI do the thinking in their stead, what hope do they have of being able to debug it?<p>Ironically, though, programming already suffers from this exact problem in a very fundamental way: every tool exists to make a programmer&#x27;s life easier, and consequently there are a lot of glue-code programmers. The few that actually impact the industry meaningfully (e.g. most notable software comes out of Bay Area) are very expensive because the supply of experts is limited.",28405714,,,,,
28407546,,comment,johncowan,2021-09-03 19:21:26,"We usually write RnRS.  If you&#x27;re into Unicode or markup languages like TeX and HTML, you can write R⁴RS, R⁵RS, R⁶RS, R⁷RS, or generally RⁿRS.<p>And yes, I think that &quot;The Revised Revised Revised Revised Revised Revised Revised Report on the Algorithmic Language Scheme&quot; is pushing the joke rather too far, but R⁷RS is what name got consensus.  It&#x27;s modeled on &quot;The {,Revised|Modified} Report on the Algorithmic Language Algol 60&quot;, where the usual abbreviations were R, RR, MR, but I like to write R⁰RA60, R¹A60, R²RA60 instead. Ditto with R⁰RA68, R¹A68 for the distinct language Algol 68.  Finally, the incomplete report on the Scheme offshoot Kernel is R⁻¹RK.",28398845,,,,,
28407547,,comment,SheinhardtWigCo,2021-09-03 19:21:32,"An Apple software VP forwarded the memo to engineers, saying:<p>&gt;  I wanted to share this note that we received today from NCMEC. I found it incredibly motivating, and hope that you will as well.<p><a href=""https:&#x2F;&#x2F;9to5mac.com&#x2F;2021&#x2F;08&#x2F;06&#x2F;apple-internal-memo-icloud-photo-scanning-concerns&#x2F;"" rel=""nofollow"">https:&#x2F;&#x2F;9to5mac.com&#x2F;2021&#x2F;08&#x2F;06&#x2F;apple-internal-memo-icloud-ph...</a>",28406409,,,,,
24318152,,story,finphil,2020-08-29 19:09:37,,,,https://theconversation.com/controlling-childrens-passwords-is-a-flagrant-breach-of-their-privacy-141031,2,Controlling children’s passwords is a flagrant breach of their privacy,0
24617935,,comment,alanfranz,2020-09-28 16:49:36,"Static Linking vs Dynamic Linking is a choice that has tradeoffs. If you only consider what&#x27;s good about dynamic linking and ignore its shortcomings, sure: dynamic linking is The Right Choice!<p>But I see no mention of those tradeoffs. Examples: what if the system-provided library is old or has bugs? What if you&#x27;re delivering to multiple distributions (or even OSes) and you need a consistent behaviour? What if you need different versions of a library?",24605256,"{24618167,24618190,24619526,24618015}",,,,
24617936,,comment,cnst,2020-09-28 16:49:39,"Just because a fee is due annually doesn&#x27;t mean you don&#x27;t &quot;own&quot; whatever it is that you &quot;lease&quot;.<p>In the real world, you still have to pay taxes and HOA fees on real estate property that you own; plus, have to put up (or finance) a huge deposit in order to &quot;own&quot; it.  Same goes for any other large property like cars.<p>You&#x27;re talking about trademarks, but trademarks themselves often require renewal every 10 years, where you have to continue paying a renewal fee in order to continue to &quot;own&quot; it.",24608672,{24707105},,,,
24617937,,comment,mprovost,2020-09-28 16:49:40,"atime doesn&#x27;t quite work because it makes a read operation into a write. Mostly that&#x27;s ok, because you&#x27;re just overwriting the same timestamp field over and over again. But it gets strange with filesystem snapshots or anything else that might be copy on write. Now your reads end up using disk space as it has to make a copy of each directory to update the atime - if it is in fact doing that. Traditionally, reading a snapshot just didn&#x27;t update the atime (but then does the snapshot keep the atime as it was at the time of the snapshot, and reading files in the live filesystem means making a copy?). This means, as was pointed out, snapshots aren&#x27;t POSIX compliant.",24617374,"{24622502,24619081}",,,,
24617938,,comment,haolez,2020-09-28 16:49:48,"What&#x27;s the cost? I think it&#x27;s something like 7% of your company upfront, right?",24616649,{24617962},,,,
24617939,,comment,tyingq,2020-09-28 16:50:25,"I&#x27;d be interested in comparing a fast CRC checksum versus their approach of stat() plus pulling a sequence number. I&#x27;m sure it&#x27;s slower, but I&#x27;m curious how much slower for tens of thousands of files.",24617800,{24618793},,,,
24617940,,comment,kentonv,2020-09-28 16:50:26,"Possibly. We did not base the design (or name) of Durable Objects on any other product we were aware of (except arguably Sandstorm.io, which was my startup before joining Cloudflare). I haven&#x27;t looked closely at Azure Durable Functions.<p>We actually did call this product &quot;Actors&quot; internally for a long time, but we found that people who had done previous Actor Model work (e.g. in Erlang) ended up more confused than enlightened by this name, so we ditched it.",24617758,{24619303},,,,
24617941,,comment,082349872349872,2020-09-28 16:50:28,"Wow. We somehow failed to notice that horses don&#x27;t fit in foxholes, but we did eventually get rid of ours when we noticed they weren&#x27;t really cut out for NBC suits.<p>(Youtube is failing miserably for <i>Parade Song of the Camp Animals</i>. Kipling actually had tunes in mind for them, something none of the interpreters in my bubble seem to have noticed.<p>For instance: <a href=""https:&#x2F;&#x2F;www.youtube.com&#x2F;watch?v=Av2-A-igOJk"" rel=""nofollow"">https:&#x2F;&#x2F;www.youtube.com&#x2F;watch?v=Av2-A-igOJk</a><p><pre><code>    By the brand on my shoulder, the finest of tunes
    Is played by the Lancers, Hussars, and Dragoons,
    And it&#x27;s sweeter than &quot;Stables&quot; or &quot;Water&quot; to me--
    The Cavalry Canter of &quot;Bonnie Dundee&quot;!

    Then feed us and break us and handle and groom,
    And give us good riders and plenty of room,
    And launch us in column of squadron and see
    The way of the war-horse to &quot;Bonnie Dundee&quot;! )</code></pre>",24617872,"{24617976,24618199}",,,,
24617942,,comment,ialexpw,2020-09-28 16:50:39,Really nice looking app and I&#x27;ve been looking to move to something else. Will give it a try :-),24616940,{24619447},,,,
24617943,,comment,hayksaakian,2020-09-28 16:50:46,"Right that&#x27;s the theory and you can read about it in his various books.<p>So instead of paying $260k per year for 10 engineers (2.6M), they might pay 451k for 3 &quot;10x&quot; engineers (1.3M). Costs are 50% lower overall, and if the engineers are even 2x more productive than the average you &quot;break even&quot;.<p>Smaller staff means you need fewer managers.<p>I&#x27;m not saying this is actually how it works in real life (can a developer really be 10x more productive? who know). This is just their operating theory.<p>Source: <a href=""https:&#x2F;&#x2F;www.levels.fyi&#x2F;?compare=Netflix,Google,Facebook,Microsoft&amp;track=Software%20Engineer"" rel=""nofollow"">https:&#x2F;&#x2F;www.levels.fyi&#x2F;?compare=Netflix,Google,Facebook,Micr...</a>",24617895,{24618500},,,,
24617944,,comment,dredmorbius,2020-09-28 16:50:48,"How one feels about a truth generally has little weight on the <i>validity</i> of a truth.<p>Tha&#x27;s not always the case, notably in systems in which beliefs themselves form a feedback.  In which case the salience is less that beliefs would invalidate the prediction as overly long, but rather that unbelief at population levels would instead <i>extend</i> the timespan and push back the endgame through a failure to take effective hygenic and preventive measures.<p>IFR neglects long-term adverse effects, also notable.",24617341,,,,,
24617945,,comment,nixgeek,2020-09-28 16:50:49,"They write about some of the interesting engineering work on various blogs.<p><a href=""https:&#x2F;&#x2F;netflixtechblog.com&#x2F;"" rel=""nofollow"">https:&#x2F;&#x2F;netflixtechblog.com&#x2F;</a>",24617895,,,,,
24617946,,comment,mmcconnell1618,2020-09-28 16:50:49,"It looks like Trump has paid millions in taxes at some times but also has more than $1 billion in losses that have offset almost all of his taxes for decades. My takeaway is that he has been able to rake in huge amounts of money (like $200 million+ from the Apprentice) but he then pours it into businesses that appear to lose money on paper. He lives his life on the back on these businesses so his lifestyle is almost 100% deductible. He&#x27;s found away to keep spending an extra 20% to 30% by avoiding income tax. However, he&#x27;s also spending like a drunken sailor and currently has more than $400 million in loans due in just a few years with personal guarantees.",24617864,,,,,
24617947,,comment,trungdq88,2020-09-28 16:50:58,"Well, I think if the app get popular enough, eventually someone will do it. I just hope that whoever do it is kind enough to give me a credit (and the link to buy) in the install message or something.",24617218,,,,,
24617948,,comment,correcting_err,2020-09-28 16:51:05,"This is just not an accurate assessment of the admissions process.<p>&gt; Neither is being non-white likely to help you much<p>Oh please. I actually think this is a good thing, but you&#x27;re kidding yourself if you think being a non-Asian minority isn&#x27;t an absolutely massive boost, even in professional school (and note: law school isn&#x27;t grad school).<p>Similarly, the parents of influential and well-connected children will get a second look, plus as others have mentioned - many of the tasks you are listing are limited to the wealthy.<p>It definitely takes merit to get into Yale law - but even with merit it is a crapshoot. Being rich, well-connected, or the benefit of affirmative action policies gives you a step up there. This is also true for HMS.",24612292,,,,,
26665088,,comment,dathinab,2021-04-01 20:39:33,"It&#x27;s a bit different then lottery.<p>Each crypto currency (well most) act like a collectors marked, i.e like art, antiques, trading cards and so on.<p>The only lottery aspect is weather or not niche currencies become well established, kinda like weather or new sources of classical collectibles become well established.<p>Some now would argue that collectibles in difference to crypto currencies have a real world value which backs them but that&#x27;s a misconception such real world value is most times completely negligible if the collectors marked fails. In some cases it will even cost you money to get right of the now basically worthless collectibles.<p>Also similar to there being cryptocurrency which are a scam there are collectibles which are such. Like supposedly priceless pictures being sold for over a thousand dollar being only worth like 5 dollar or so, i.e. you basically lose the full investment",26663756,,,,,
26665089,,comment,35fbe7d3d5b9,2021-04-01 20:39:46,"Ask Saddam Hussein, who tried to price Iraqi oil in Euros in 2000.  Or Gaddafi, who was tolerated by western powers until he tried to introduce the pan-African gold Dinar and encourage oil producing nations to de-dollarize in favor of it.",26664960,"{26665662,26665319}",,,,
26665090,,comment,jsight,2021-04-01 20:39:48,"I think that is going to depend on your definition of &quot;significant&quot;. I think at best we would have similar numbers to Israel right now by then. That would still represent &gt;250 deaths per day.<p>(EDIT: If there is some reason that our rates will fall more quickly, I&#x27;d love to hear it.)",26664570,"{26665382,26665237,26666756}",,,,
26665091,,comment,,2021-04-01 20:39:53,,26661443,,,,,
26665092,,comment,pixl97,2021-04-01 20:40:06,&gt;Gold.  There&#x27;s a fixed amount of it with a pretty well known supply and demand.<p>At least until someone lands a autonomous mining craft on an asteroid full of it can crashes the market. Anything can be upset by changes in technology.,26664831,{26665186},,,,
26665093,,comment,mayli,2021-04-01 20:40:07,aka click bait,26662985,{26665836},,,,
26665094,,comment,c0achmcguirk,2021-04-01 20:40:12,And dynamic--anything dynamic--was completely insanely cool.,26664155,,,,,
26665095,,comment,Scarbutt,2021-04-01 20:40:25,I&#x27;m surprised you didn&#x27;t mention the Streams API.,26663788,,,,,
26665096,,comment,rq1,2021-04-01 20:40:32,:0,26665081,,,,,
26665097,,story,undefined1,2021-04-01 20:40:33,,,"{26666266,26666502,26666351,26666499,26666467,26666240,26666642,26667167,26666598,26666683,26666147,26666469,26667362,26666379,26666947,26666600,26666695,26666690,26666727,26666314}",https://sfzoning.deapthoughts.com/illegal_homes.html,200,54% of San Francisco homes are in buildings that would be illegal to build today,220
